{
  "x402": {
    "verb": "clean",
    "version": "1.0.0",
    "request_id": "req-clean-2025-11-19-0001"
  },
  "actor": "did:example:caller-001",
  "limits": {
    "max_output_tokens": 1024,
    "timeout_ms": 5000
  },
  "channel": {
    "protocol": "https",
    "input_modalities": ["text"],
    "output_modalities": ["text"]
  },
  "input": {
    "content": "  This is   noisy   text with   extra   spaces, HTML <b>tags</b>, and   weird   spacing.  ",
    "operations": [
      "trim",
      "normalize_whitespace",
      "strip_html"
    ]
  }
}
